user_input,retrieved_contexts,response,reference,faithfulness
"Tui bị tiểu đường, sáng ăn ổ bánh mì thịt được hông?","['--- TRI THỨC ĐỐI THOẠI LÂM SÀNG ĐÃ ĐỐI SOÁT (BỘ Y TẾ) ---\n❓ Tình huống lâm sàng: Tui bị tiểu đường, sáng ăn ổ bánh mì thịt được hông?\n💡 Chuyên gia tư vấn: Được, nhưng cần kiểm soát khẩu phần. Bánh mì chứa lượng carbohydrate cao, người bệnh nên phối hợp thêm nhiều rau xanh để tăng chất xơ giúp làm chậm quá trình hấp thu glucose.\n📚 Nguồn trích dẫn: Tài liệu Dinh dưỡng lâm sàng - Bộ Y tế (Khẩu ngữ hóa)\n']","Không có thông tin cụ thể về chỉ số dinh dưỡng của bánh mì thịt trong dữ liệu được cung cấp. 

📚 Nguồn trích dẫn y văn gốc: Tài liệu Dinh dưỡng lâm sàng - Bộ Y tế (Khẩu ngữ hóa)","Được, nhưng cần kiểm soát khẩu phần. Bánh mì chứa lượng carbohydrate cao, người bệnh nên phối hợp thêm nhiều rau xanh để tăng chất xơ giúp làm chậm quá trình hấp thu glucose[cite: 1].",100.0
"Bác sĩ ơi em bị đường huyết cao, ăn cơm trắng hoài có sao không?","['--- TRI THỨC ĐỐI THOẠI LÂM SÀNG ĐÃ ĐỐI SOÁT (BỘ Y TẾ) ---\n❓ Tình huống lâm sàng: Bác sĩ ơi em bị đường huyết cao, ăn cơm trắng hoài có sao không?\n💡 Chuyên gia tư vấn: Ăn cơm trắng lượng nhiều và liên tục có thể làm tăng nhanh glucose máu sau ăn. Y văn Bộ Y tế khuyến nghị người bệnh nên kiểm soát khối lượng cơm trong mỗi bữa, có thể thay thế bằng gạo lứt để tăng chất xơ hòa tan.\n📚 Nguồn trích dẫn: Tài liệu Dinh dưỡng lâm sàng - Bộ Y tế (Khẩu ngữ hóa)\n']","Chỉ số đường huyết (GI) của cơm trắng là 80. 
Năng lượng trong 100g cơm trắng là 130 kcal, Carbohydrate là 28g, Chất đạm là 2g, Natri là 1mg, Kali là 55mg.

📚 Nguồn trích dẫn y văn gốc: Tài liệu Dinh dưỡng lâm sàng - Bộ Y tế, trang 120","Ăn cơm trắng lượng nhiều và liên tục có thể làm tăng nhanh glucose máu sau ăn[cite: 1]. Y văn Bộ Y tế khuyến nghị người bệnh nên kiểm soát khối lượng cơm trong mỗi bữa, có thể thay thế bằng gạo lứt để tăng chất xơ hòa tan[cite: 1].",0.0
Tiểu đường mà ghiền trà sữa quá thì uống được không?,"['--- TRI THỨC ĐỐI THOẠI LÂM SÀNG ĐÃ ĐỐI SOÁT (BỘ Y TẾ) ---\n❓ Tình huống lâm sàng: Tiểu đường mà ghiền trà sữa quá thì uống được không?\n💡 Chuyên gia tư vấn: Không nên. Trà sữa chứa hàm lượng đường đơn (sucrose, glucose) và chất béo bão hòa rất cao, gây nguy cơ tăng vọt đường huyết đột ngột và ảnh hưởng xấu đến lipid máu mạn tính.\n📚 Nguồn trích dẫn: Tài liệu Dinh dưỡng lâm sàng - Bộ Y tế (Khẩu ngữ hóa)\n']","Không nên uống trà sữa vì chứa hàm lượng đường đơn và chất béo bão hòa cao.
📚 Nguồn trích dẫn y văn gốc: Tài liệu Dinh dưỡng lâm sàng - Bộ Y tế","Không nên. Trà sữa chứa hàm lượng đường đơn (sucrose, glucose) và chất béo bão hòa rất cao, gây nguy cơ tăng vọt đường huyết đột ngột và ảnh hưởng xấu đến lipid máu mạn tính[cite: 1].",100.0
Bị cao huyết áp ăn cá khô với cơm mỗi ngày được không?,"['--- TRI THỨC ĐỐI THOẠI LÂM SÀNG ĐÃ ĐỐI SOÁT (BỘ Y TẾ) ---\n❓ Tình huống lâm sàng: Bị cao huyết áp ăn cá khô với cơm mỗi ngày được không?\n💡 Chuyên gia tư vấn: Không nên. Cá khô là thực phẩm ướp muối chứa hàm lượng natri cực kỳ cao, vi phạm nghiêm trọng nguyên tắc chế độ ăn ít natri (< 2000 mg/ngày) cho người tăng huyết áp, dễ gây tai biến mạch máu.\n📚 Nguồn trích dẫn: Tài liệu Dinh dưỡng lâm sàng - Bộ Y tế (Khẩu ngữ hóa)\n']","Natri trong 100g cá khô: Chưa cập nhật
Natri trong 1 phần ăn cá khô với cơm: Chưa cập nhật
📚 Nguồn trích dẫn y văn gốc: Tài liệu Dinh dưỡng lâm sàng - Bộ Y tế","Không nên. Cá khô là thực phẩm ướp muối chứa hàm lượng natri cực kỳ cao, vi phạm nghiêm trọng nguyên tắc chế độ ăn ít natri (< 2000 mg/ngày) cho người tăng huyết áp, dễ gây tai biến mạch máu[cite: 1].",50.0
Tôi bị tăng huyết áp mà thích ăn dưa cải muối thì có sao không?,"['--- TRI THỨC ĐỐI THOẠI LÂM SÀNG ĐÃ ĐỐI SOÁT (BỘ Y TẾ) ---\n❓ Tình huống lâm sàng: Tôi bị tăng huyết áp mà thích ăn dưa cải muối thì có sao không?\n💡 Chuyên gia tư vấn: Cần hạn chế tối đa. Các loại dưa cải muối chứa lượng muối (natri) rất cao, dễ gây giữ nước, tăng thể tích tuần hoàn và làm trầm trọng thêm tình trạng tăng huyết áp.\n📚 Nguồn trích dẫn: Tài liệu Dinh dưỡng lâm sàng - Bộ Y tế (Khẩu ngữ hóa)\n']","Natri: Rất cao.
Kali: Chưa cập nhật.
Glucid: Chưa cập nhật.
Năng lượng: Chưa cập nhật.
Chất đạm: Chưa cập nhật.

📚 Nguồn trích dẫn y văn gốc: Tài liệu Dinh dưỡng lâm sàng - Bộ Y tế","Cần hạn chế tối đa. Các loại dưa cải muối chứa lượng muối (natri) rất cao, dễ gây giữ nước, tăng thể tích tuần hoàn và làm trầm trọng thêm tình trạng tăng huyết áp[cite: 1].",
